{
  "schemaVersion": 1,
  "startDate": "2026-09-15",
  "strategy": {
    "factor": "m121",
    "momDays": 0,
    "momSkip": 0,
    "customFormula": "",
    "customLabel": "",
    "customBetterWhen": "high",
    "topN": 5,
    "poolTopN": 50,
    "rebalance": "M",
    "rebalanceDay": 5,
    "weighting": "equal",
    "execLagDays": 1,
    "stopType": "trailing",
    "stopPct": 20,
    "stopMaDays": 20,
    "stopExecNext": false,
    "swapOnBetter": false,
    "swapMargin": 15,
    "swapMinHoldDays": 10,
    "swapExecNext": true,
    "regime": "ma",
    "regimeDays": 200,
    "regimeExit": "rebalance",
    "bearHolding": "cash"
  },
  "holdings": [
    { "code": "2330", "shares": 2000, "entryPrice": 2450, "entryDate": "2026-09-15" }
  ],
  "trades": [
    { "id": "a1", "date": "2026-09-15", "code": "2330", "side": "buy", "shares": 1000, "price": 2400 },
    { "id": "a2", "date": "2026-09-22", "code": "2330", "side": "buy", "shares": 1000, "price": 2500 }
  ]
}
